<?xml version="1.0" encoding="UTF-8"?>
<!DOCTYPE placaBase SYSTEM "ejercicio1.dtd">

<placaBase>
<placa>
    <microprocesador>Procesador Intel Core i7</microprocesador>
    <memoria>4Gb</memoria>
    <modelo>8500Y</modelo>
    <fabricante><Intel/></fabricante>
</placa>
<placa>
    <microprocesador>Asus ROG </microprocesador>
    <memoria>64Gb</memoria>
    <modelo>Rampage VI Apex</modelo>
    <fabricante><Asus/></fabricante>

</placa>


</placaBase>

